{
  "$schema": "http://json-schema.org/draft-07/schema#",
  "title": "KnowledgeGraphSchema",
  "description": "Схема базы знаний профессионального опыта разработчика (Engineering Knowledge Graph)",
  "type": "object",
  "properties": {
    "skills": {
      "type": "array",
      "items": {
        "type": "object",
        "properties": {
          "id": {
            "type": "string"
          },
          "name": {
            "type": "string"
          },
          "category": {
            "type": "string"
          },
          "subcategory": {
            "type": [
              "string",
              "null"
            ]
          },
          "description": {
            "type": [
              "string",
              "null"
            ]
          },
          "level": {
            "type": [
              "string",
              "null"
            ]
          },
          "first_used": {
            "type": [
              "string",
              "null"
            ]
          },
          "last_used": {
            "type": [
              "string",
              "null"
            ]
          },
          "projects": {
            "type": "array",
            "items": {
              "type": "string"
            }
          },
          "experience": {
            "type": "array",
            "items": {
              "type": "string"
            }
          },
          "repositories": {
            "type": "array",
            "items": {
              "type": "string"
            }
          },
          "facts": {
            "type": "array",
            "items": {
              "type": "string"
            }
          },
          "evidence": {
            "type": "array",
            "items": {
              "type": "string"
            }
          },
          "years_of_usage": {
            "type": [
              "number",
              "null"
            ]
          },
          "confidence": {
            "type": "number",
            "minimum": 0.0,
            "maximum": 1.0
          },
          "verification_status": {
            "type": "string",
            "enum": [
              "verified",
              "unverified"
            ]
          }
        },
        "required": [
          "id",
          "name",
          "category",
          "confidence"
        ]
      }
    },
    "projects": {
      "type": "array",
      "items": {
        "type": "object",
        "properties": {
          "id": {
            "type": "string"
          },
          "name": {
            "type": "string"
          },
          "description": {
            "type": "string"
          },
          "project_type": {
            "type": [
              "string",
              "null"
            ]
          },
          "status": {
            "type": [
              "string",
              "null"
            ]
          },
          "start_date": {
            "type": [
              "string",
              "null"
            ]
          },
          "end_date": {
            "type": [
              "string",
              "null"
            ]
          },
          "technologies": {
            "type": "array",
            "items": {
              "type": "string"
            }
          },
          "architecture": {
            "type": "object",
            "properties": {
              "pattern": {
                "type": [
                  "string",
                  "null"
                ]
              },
              "diagram_mermaid": {
                "type": [
                  "string",
                  "null"
                ]
              }
            }
          },
          "lessons_learned": {
            "type": "array",
            "items": {
              "type": "string"
            }
          },
          "repositories": {
            "type": "array",
            "items": {
              "type": "string"
            }
          },
          "facts": {
            "type": "array",
            "items": {
              "type": "string"
            }
          },
          "metrics": {
            "type": "array",
            "items": {
              "type": "string"
            }
          },
          "evidence": {
            "type": "array",
            "items": {
              "type": "string"
            }
          }
        },
        "required": [
          "id",
          "name",
          "description"
        ]
      }
    },
    "technologies": {
      "type": "array",
      "items": {
        "type": "object",
        "properties": {
          "id": {
            "type": "string"
          },
          "name": {
            "type": "string"
          },
          "category": {
            "type": "string"
          },
          "vendor": {
            "type": [
              "string",
              "null"
            ]
          },
          "documentation_url": {
            "type": [
              "string",
              "null"
            ],
            "format": "uri"
          },
          "projects": {
            "type": "array",
            "items": {
              "type": "string"
            }
          },
          "facts": {
            "type": "array",
            "items": {
              "type": "string"
            }
          },
          "repositories": {
            "type": "array",
            "items": {
              "type": "string"
            }
          }
        },
        "required": [
          "id",
          "name",
          "category"
        ]
      }
    },
    "repositories": {
      "type": "array",
      "items": {
        "type": "object",
        "properties": {
          "id": {
            "type": "string"
          },
          "name": {
            "type": "string"
          },
          "url": {
            "type": "string",
            "format": "uri"
          },
          "description": {
            "type": [
              "string",
              "null"
            ]
          },
          "language": {
            "type": [
              "string",
              "null"
            ]
          },
          "frameworks": {
            "type": "array",
            "items": {
              "type": "string"
            }
          },
          "topics": {
            "type": "array",
            "items": {
              "type": "string"
            }
          },
          "projects": {
            "type": "array",
            "items": {
              "type": "string"
            }
          },
          "facts": {
            "type": "array",
            "items": {
              "type": "string"
            }
          },
          "readme": {
            "type": [
              "string",
              "null"
            ]
          },
          "license": {
            "type": [
              "string",
              "null"
            ]
          },
          "visibility": {
            "type": "string",
            "enum": [
              "public",
              "private"
            ]
          }
        },
        "required": [
          "id",
          "name",
          "url"
        ]
      }
    },
    "extracted_facts": {
      "type": "array",
      "items": {
        "type": "object",
        "properties": {
          "id": {
            "type": "string"
          },
          "title": {
            "type": [
              "string",
              "null"
            ]
          },
          "summary": {
            "type": [
              "string",
              "null"
            ]
          },
          "description": {
            "type": "string"
          },
          "source": {
            "type": "string"
          },
          "project_id": {
            "type": [
              "string",
              "null"
            ]
          },
          "experience_id": {
            "type": [
              "string",
              "null"
            ]
          },
          "repository_id": {
            "type": [
              "string",
              "null"
            ]
          },
          "technologies": {
            "type": "array",
            "items": {
              "type": "string"
            }
          },
          "metrics": {
            "type": "array",
            "items": {
              "type": "string"
            }
          },
          "evidence": {
            "type": "array",
            "items": {
              "type": "string"
            }
          },
          "lessons": {
            "type": "array",
            "items": {
              "type": "string"
            }
          },
          "confidence": {
            "type": "number",
            "minimum": 0.0,
            "maximum": 1.0
          },
          "tags": {
            "type": "array",
            "items": {
              "type": "string"
            }
          },
          "created_at": {
            "type": [
              "string",
              "null"
            ]
          },
          "updated_at": {
            "type": [
              "string",
              "null"
            ]
          }
        },
        "required": [
          "id",
          "description",
          "source",
          "confidence"
        ]
      }
    },
    "metrics": {
      "type": "array",
      "items": {
        "type": "object",
        "properties": {
          "id": {
            "type": "string"
          },
          "metric_type": {
            "type": "string"
          },
          "before": {
            "type": [
              "string",
              "null"
            ]
          },
          "after": {
            "type": [
              "string",
              "null"
            ]
          },
          "unit": {
            "type": "string"
          },
          "improvement_percent": {
            "type": [
              "number",
              "null"
            ]
          },
          "confidence": {
            "type": "number",
            "minimum": 0.0,
            "maximum": 1.0
          },
          "project_id": {
            "type": [
              "string",
              "null"
            ]
          },
          "fact_id": {
            "type": [
              "string",
              "null"
            ]
          }
        },
        "required": [
          "id",
          "metric_type",
          "unit",
          "confidence"
        ]
      }
    },
    "lessons_learned": {
      "type": "array",
      "items": {
        "type": "object",
        "properties": {
          "id": {
            "type": "string"
          },
          "title": {
            "type": "string"
          },
          "description": {
            "type": "string"
          },
          "category": {
            "type": [
              "string",
              "null"
            ]
          },
          "project": {
            "type": [
              "string",
              "null"
            ]
          },
          "technologies": {
            "type": "array",
            "items": {
              "type": "string"
            }
          },
          "tags": {
            "type": "array",
            "items": {
              "type": "string"
            }
          },
          "confidence": {
            "type": "number",
            "minimum": 0.0,
            "maximum": 1.0
          }
        },
        "required": [
          "id",
          "title",
          "description",
          "confidence"
        ]
      }
    },
    "decisions": {
      "type": "array",
      "items": {
        "type": "object",
        "properties": {
          "id": {
            "type": "string"
          },
          "problem": {
            "type": "string"
          },
          "options": {
            "type": "array",
            "items": {
              "type": "object",
              "properties": {
                "name": {
                  "type": "string"
                },
                "description": {
                  "type": [
                    "string",
                    "null"
                  ]
                }
              },
              "required": [
                "name"
              ]
            }
          },
          "selected_option": {
            "type": "string"
          },
          "reason": {
            "type": "string"
          },
          "tradeoffs": {
            "type": [
              "string",
              "null"
            ]
          },
          "consequences": {
            "type": [
              "string",
              "null"
            ]
          },
          "project_id": {
            "type": [
              "string",
              "null"
            ]
          },
          "technologies": {
            "type": "array",
            "items": {
              "type": "string"
            }
          }
        },
        "required": [
          "id",
          "problem",
          "selected_option",
          "reason"
        ]
      }
    },
    "evidence": {
      "type": "array",
      "items": {
        "type": "object",
        "properties": {
          "id": {
            "type": "string"
          },
          "type": {
            "type": "string"
          },
          "source": {
            "type": "string"
          },
          "location": {
            "type": [
              "string",
              "null"
            ]
          },
          "description": {
            "type": [
              "string",
              "null"
            ]
          },
          "confidence": {
            "type": "number",
            "minimum": 0.0,
            "maximum": 1.0
          }
        },
        "required": [
          "id",
          "type",
          "source",
          "confidence"
        ]
      }
    }
  },
  "required": [
    "skills",
    "repositories",
    "extracted_facts",
    "projects",
    "technologies",
    "evidence"
  ]
}