{
  "skills": [
    {
      "id": "skill_etl_pipelines",
      "name": "ETL Pipelines Sync",
      "category": "Data Engineering",
      "level": "Advanced",
      "confidence": 0.95,
      "verification_status": "unverified"
    },
    {
      "id": "skill_workflow_automation",
      "name": "Workflow Automation",
      "category": "Integration",
      "level": "Expert",
      "confidence": 0.95,
      "verification_status": "unverified"
    },
    {
      "id": "skill_rag_design",
      "name": "RAG System Design",
      "category": "AI Engineering",
      "level": "Advanced",
      "confidence": 0.9,
      "verification_status": "unverified"
    },
    {
      "id": "skill_enterprise_integration",
      "name": "Enterprise Integration",
      "category": "Integration",
      "level": "Advanced",
      "confidence": 0.9,
      "verification_status": "unverified"
    },
    {
      "id": "skill_idempotency",
      "name": "Idempotent Process Design",
      "category": "Architecture",
      "level": "Advanced",
      "confidence": 0.95,
      "verification_status": "unverified"
    },
    {
      "id": "skill_text_to_sql",
      "name": "Text-to-SQL Implementation",
      "category": "AI Engineering",
      "level": "Intermediate",
      "confidence": 0.85,
      "verification_status": "unverified"
    },
    {
      "id": "skill_zero_data_leak",
      "name": "Zero Data Leak Architecture",
      "category": "Security",
      "level": "Advanced",
      "confidence": 0.9,
      "verification_status": "unverified"
    },
    {
      "id": "skill_ci_cd",
      "name": "CI/CD Pipeline Management",
      "category": "DevOps",
      "level": "Advanced",
      "confidence": 0.85,
      "verification_status": "unverified"
    },
    {
      "id": "backend_development",
      "name": "Backend Development",
      "category": "Uncategorized",
      "confidence": 0.5,
      "verification_status": "unverified"
    },
    {
      "id": "etl_pipelines_sync",
      "name": "ETL Pipelines Sync",
      "category": "Uncategorized",
      "confidence": 0.5,
      "verification_status": "unverified"
    },
    {
      "id": "workflow_automation",
      "name": "Workflow Automation",
      "category": "Uncategorized",
      "confidence": 0.5,
      "verification_status": "unverified"
    },
    {
      "id": "rag_system_design",
      "name": "RAG System Design",
      "category": "Uncategorized",
      "confidence": 0.5,
      "verification_status": "unverified"
    },
    {
      "id": "vector_search",
      "name": "Vector Search",
      "category": "Uncategorized",
      "confidence": 0.5,
      "verification_status": "unverified"
    },
    {
      "id": "enterprise_integration",
      "name": "Enterprise Integration",
      "category": "Uncategorized",
      "confidence": 0.5,
      "verification_status": "unverified"
    },
    {
      "id": "idempotent_process_design",
      "name": "Idempotent Process Design",
      "category": "Uncategorized",
      "confidence": 0.5,
      "verification_status": "unverified"
    },
    {
      "id": "data_normalization",
      "name": "Data Normalization",
      "category": "Uncategorized",
      "confidence": 0.5,
      "verification_status": "unverified"
    },
    {
      "id": "text-to-sql_implementation",
      "name": "Text-to-SQL Implementation",
      "category": "Uncategorized",
      "confidence": 0.5,
      "verification_status": "unverified"
    },
    {
      "id": "zero_data_leak_architecture",
      "name": "Zero Data Leak Architecture",
      "category": "Uncategorized",
      "confidence": 0.5,
      "verification_status": "unverified"
    },
    {
      "id": "ci/cd_pipeline_management",
      "name": "CI/CD Pipeline Management",
      "category": "Uncategorized",
      "confidence": 0.5,
      "verification_status": "unverified"
    },
    {
      "id": "business_process_automation",
      "name": "Business Process Automation",
      "category": "Uncategorized",
      "confidence": 0.5,
      "verification_status": "unverified"
    },
    {
      "id": "kpi_calculation_&_reporting",
      "name": "KPI Calculation & Reporting",
      "category": "Uncategorized",
      "confidence": 0.5,
      "verification_status": "unverified"
    },
    {
      "id": "system_administration",
      "name": "System Administration",
      "category": "Uncategorized",
      "confidence": 0.5,
      "verification_status": "unverified"
    },
    {
      "id": "mvp_development",
      "name": "MVP Development",
      "category": "Uncategorized",
      "confidence": 0.5,
      "verification_status": "unverified"
    }
  ],
  "projects": [
    {
      "id": "proj_greenleaf",
      "name": "GreenLeaf AI Consultant",
      "description": "SaaS AI-консультант для e-commerce каталога wellness-продукции. Telegram-бот с RAG-системой, гибридным поиском и реферальной системой для партнеров.",
      "project_type": "commercial",
      "status": "production",
      "start_date": "CONFLICT: 2025-07 | 2025-08",
      "end_date": "Present",
      "technologies": [
        "tech_python",
        "tech_aiogram",
        "tech_openai",
        "tech_postgresql",
        "tech_pgvector",
        "tech_supabase",
        "tech_docker",
        "tech_github_actions",
        "tech_hetzner"
      ],
      "architecture": {
        "pattern": "RAG + Hybrid Search + Microservices (Bot)",
        "diagram_mermaid": "graph TD\n    A[Telegram Users] -->|Bot API| B(Aiogram Bot)\n    B --> C{AccessMiddleware}\n    C -->|Valid| D[LLM Engine OpenAI]\n    C -->|Valid| E[DB Layer Supabase/PostgreSQL]\n    E --> F[pgvector Semantic Search]\n    E --> G[Keyword Search]\n    F & G --> H[Hybrid Results]\n    H --> D\n    D --> I[Personalized Response]\n    I --> A"
      },
      "lessons_learned": [
        "lesson_rag_hybrid",
        "lesson_cost_optimization"
      ],
      "repositories": [],
      "facts": [
        "fact_greenleaf_users",
        "fact_greenleaf_retention"
      ],
      "metrics": [
        "metric_greenleaf_time",
        "metric_greenleaf_cost",
        "metric_greenleaf_retention",
        "metric_greenleaf_messages"
      ],
      "evidence": [
        "ev_greenleaf_md",
        "ev_cv_docx"
      ]
    },
    {
      "id": "proj_mediacube_sync",
      "name": "MC PAY -> NAV Integration",
      "description": "Автоматизация синхронизации биллинговой платформы MC PAY с ERP Microsoft Dynamics NAV через n8n. Идемпотентный ETL-пайплайн создания контрагентов.",
      "project_type": "commercial",
      "status": "production",
      "start_date": "2026-02",
      "end_date": "2026-04",
      "technologies": [
        "tech_n8n",
        "tech_postgresql",
        "tech_microsoft_dynamics_nav",
        "tech_soap",
        "tech_slack_api",
        "tech_sql"
      ],
      "architecture": {
        "pattern": "ETL + Scheduled Workflow + Idempotent Sync",
        "diagram_mermaid": "graph TD\n    A[MC PAY PostgreSQL] -->|SQL SELECT| B(n8n Workflow)\n    B --> C{Check Vendor Exists?}\n    C -->|No| D[SOAP Create Vendor]\n    C -->|Yes| E[Skip]\n    D --> F[XML to JSON Mapping]\n    F --> G[Log & Slack Notify]\n    E --> G\n    G --> H[Microsoft Dynamics NAV]"
      },
      "lessons_learned": [
        "lesson_idempotency",
        "lesson_soap_erp",
        "lesson_n8n_batch",
        "lesson_sandbox_testing"
      ],
      "repositories": [],
      "facts": [
        "fact_vendor_sync",
        "fact_mapping_36k"
      ],
      "metrics": [
        "metric_mediacube_time",
        "metric_mediacube_report"
      ],
      "evidence": [
        "ev_mediacube_md",
        "ev_cv_docx"
      ]
    },
    {
      "id": "proj_estimate_analyzer",
      "name": "Estimate Analyzer",
      "description": "On-Premise AI-платформа для анализа строительных смет формата SANA. Парсинг Excel, нормализация в реляционную модель, Text-to-SQL интерфейс с гарантией конфиденциальности.",
      "project_type": "pet_project",
      "status": "archived",
      "start_date": "2026-01",
      "end_date": "2026-01",
      "technologies": [
        "tech_python",
        "tech_pandas",
        "tech_sqlalchemy",
        "tech_streamlit",
        "tech_alem_llm",
        "tech_sql",
        "tech_excel"
      ],
      "architecture": {
        "pattern": "Zero Data Leak + Text-to-SQL + Local Processing",
        "diagram_mermaid": "graph TD\n    A[Excel SANA] --> B[Parser & Normalizer]\n    B --> C[PostgreSQL/SQLite]\n    C --> D[SQLAlchemy ORM]\n    D --> E{Text-to-SQL Engine}\n    E -->|Schema + Query| F[Alem LLM API]\n    F -->|Generated SQL| E\n    E -->|Execute Locally| C\n    C --> G[Streamlit UI]"
      },
      "lessons_learned": [
        "lesson_data_norm_time",
        "lesson_excel_parser",
        "lesson_text_to_sql_barrier",
        "lesson_streamlit_mvp"
      ],
      "repositories": [],
      "facts": [
        "fact_estimate_security"
      ],
      "metrics": [
        "metric_estimate_time"
      ],
      "evidence": [
        "ev_estimate_md"
      ]
    },
    {
      "id": "proj_globalwine_reporting",
      "name": "Global Wine Reporting Pipeline",
      "description": "Автоматизация аналитики продаж и расчета KPI торговой команды. ETL на базе OLAP-кубов и Excel, классификация ассортимента, план-факт анализ.",
      "project_type": "commercial",
      "status": "archived",
      "start_date": "2019-11",
      "end_date": "2025-05",
      "technologies": [
        "tech_excel",
        "tech_olap",
        "tech_sql"
      ],
      "architecture": {
        "pattern": "Batch ETL + OLAP Aggregation",
        "diagram_mermaid": "graph TD\n    A[Sales Data] --> B[ETL Process]\n    B --> C[OLAP Cubes]\n    C --> D[KPI Calculation Model]\n    D --> E[Automated Report Template]"
      },
      "lessons_learned": [
        "lesson_business_automation"
      ],
      "repositories": [],
      "facts": [
        "fact_kpi_automation"
      ],
      "metrics": [
        "metric_globalwine_time"
      ],